閣法の一覧,,196,61,食品衛生法等の一部を改正する法律案,成立,経過,https://www.shugiin.go.jp/internet/itdb_gian.nsf/html/gian/keika/1DC87EA.htm,本文,https://www.shugiin.go.jp/internet/itdb_gian.nsf/html/gian/honbun/g19609061.htm,閣法,196,61,食品衛生法等の一部を改正する法律案,内閣,平成30年 3月13日,／,平成30年 4月13日,平成30年 6月 1日／厚生労働,平成30年 6月 6日／可決,平成30年 6月 7日／可決,全会一致,自由民主党; 立憲民主党・市民クラブ; 国民民主党・無所属クラブ; 公明党; 無所属の会; 日本共産党; 日本維新の会; 自由党; 社会民主党・市民連合; 希望の党,,,／,平成30年 3月13日,平成30年 4月 9日／厚生労働,平成30年 4月12日／可決,平成30年 4月13日／可決,平成30年 6月13日／46
閣法の一覧,,196,62,環太平洋パートナーシップ協定の締結に伴う関係法律の整備に関する法律の一部を改正する法律案,成立,経過,https://www.shugiin.go.jp/internet/itdb_gian.nsf/html/gian/keika/1DC88BA.htm,本文,https://www.shugiin.go.jp/internet/itdb_gian.nsf/html/gian/honbun/g19609062.htm,閣法,196,62,環太平洋パートナーシップ協定の締結に伴う関係法律の整備に関する法律の一部を改正する法律案,内閣,,／,平成30年 3月27日,平成30年 5月 8日／内閣,平成30年 5月23日／可決,平成30年 5月24日／可決,多数,自由民主党; 公明党; 日本維新の会; 希望の党,立憲民主党・市民クラブ; 国民民主党・無所属クラブ; 無所属の会; 日本共産党; 自由党; 社会民主党・市民連合,平成30年 3月27日,／,平成30年 5月24日,平成30年 6月 1日／内閣,平成30年 6月28日／可決,平成30年 6月29日／可決,平成30年 7月 6日／70
閣法の一覧,,196,63,働き方改革を推進するための関係法律の整備に関する法律案,成立,経過,https://www.shugiin.go.jp/internet/itdb_gian.nsf/html/gian/keika/1DC8956.htm,本文及び修正案,https://www.shugiin.go.jp/internet/itdb_gian.nsf/html/gian/honbun/g19609063.htm,閣法,196,63,働き方改革を推進するための関係法律の整備に関する法律案,内閣,,／,平成30年 4月 6日,平成30年 4月27日／厚生労働,平成30年 5月25日／修正,平成30年 5月31日／修正,多数,自由民主党; 公明党; 日本維新の会; 希望の党,立憲民主党・市民クラブ; 国民民主党・無所属クラブ; 無所属の会; 日本共産党; 自由党; 社会民主党・市民連合,平成30年 4月 6日,／,平成30年 5月31日,平成30年 6月 4日／厚生労働,平成30年 6月28日／可決,平成30年 6月29日／可決,平成30年 7月 6日／71
閣法の一覧,,196,64,特定複合観光施設区域整備法案,成立,経過,https://www.shugiin.go.jp/internet/itdb_gian.nsf/html/gian/keika/1DC8A1E.htm,本文,https://www.shugiin.go.jp/internet/itdb_gian.nsf/html/gian/honbun/g19609064.htm,閣法,196,64,特定複合観光施設区域整備法案,内閣,,／,平成30年 4月27日,平成30年 5月22日／内閣,平成30年 6月15日／可決,平成30年 6月19日／可決,多数,自由民主党; 公明党; 日本維新の会,立憲民主党・市民クラブ; 国民民主党・無所属クラブ; 無所属の会; 日本共産党; 自由党; 社会民主党・市民連合,平成30年 4月27日,／,平成30年 6月19日,平成30年 7月 6日／内閣,平成30年 7月19日／可決,平成30年 7月20日／可決,平成30年 7月27日／80
閣法の一覧,,196,65,災害救助法の一部を改正する法律案,成立,経過,https://www.shugiin.go.jp/internet/itdb_gian.nsf/html/gian/keika/1DC8A9A.htm,本文,https://www.shugiin.go.jp/internet/itdb_gian.nsf/html/gian/honbun/g19609065.htm,閣法,196,65,災害救助法の一部を改正する法律案,内閣,,／,平成30年 5月 8日,平成30年 5月16日／災害対策特別,平成30年 5月24日／可決,平成30年 5月25日／可決,全会一致,自由民主党; 立憲民主党・市民クラブ; 国民民主党・無所属クラブ; 公明党; 無所属の会; 日本共産党; 日本維新の会; 自由党; 社会民主党・市民連合; 希望の党,,平成30年 5月 8日,／,平成30年 5月25日,平成30年 5月29日／災害対策特別,平成30年 6月 6日／可決,平成30年 6月 8日／可決,平成30年 6月15日／52
予算の一覧,,196,1,平成二十九年度一般会計補正予算（第１号）,成立,経過,https://www.shugiin.go.jp/internet/itdb_gian.nsf/html/gian/keika/1DC6D02.htm,,,予算,196,1,平成二十九年度一般会計補正予算（第１号）,内閣,,／,平成30年 1月22日,平成30年 1月22日／予算,平成30年 1月30日／可決,平成30年 1月30日／可決,多数,自由民主党; 公明党; 日本維新の会,立憲民主党・市民クラブ; 希望の党・無所属クラブ; 無所属の会; 日本共産党; 自由党; 社会民主党・市民連合,平成30年 1月22日,平成30年 1月22日／予算,平成30年 1月30日,平成30年 1月30日／予算,平成30年 2月 1日／可決,平成30年 2月 1日／可決,／
予算の一覧,,196,2,平成二十九年度特別会計補正予算（特第１号）,成立,経過,https://www.shugiin.go.jp/internet/itdb_gian.nsf/html/gian/keika/1DC6D06.htm,,,予算,196,2,平成二十九年度特別会計補正予算（特第１号）,内閣,,／,平成30年 1月22日,平成30年 1月22日／予算,平成30年 1月30日／可決,平成30年 1月30日／可決,多数,自由民主党; 公明党; 日本維新の会,立憲民主党・市民クラブ; 希望の党・無所属クラブ; 無所属の会; 日本共産党; 自由党; 社会民主党・市民連合,平成30年 1月22日,平成30年 1月22日／予算,平成30年 1月30日,平成30年 1月30日／予算,平成30年 2月 1日／可決,平成30年 2月 1日／可決,／
予算の一覧,,196,3,平成三十年度一般会計予算,成立,経過,https://www.shugiin.go.jp/internet/itdb_gian.nsf/html/gian/keika/1DC6D0A.htm,,,予算,196,3,平成三十年度一般会計予算,内閣,,／,平成30年 1月22日,平成30年 1月22日／予算,平成30年 2月28日／可決,平成30年 2月28日／可決,多数,自由民主党; 公明党,立憲民主党・市民クラブ; 希望の党・無所属クラブ; 無所属の会; 日本共産党; 日本維新の会; 自由党; 社会民主党・市民連合,平成30年 1月22日,平成30年 1月22日／予算,平成30年 2月28日,平成30年 2月28日／予算,平成30年 3月28日／可決,平成30年 3月28日／可決,／
予算の一覧,,196,4,平成三十年度特別会計予算,成立,経過,https://www.shugiin.go.jp/internet/itdb_gian.nsf/html/gian/keika/1DC6D0E.htm,,,予算,196,4,平成三十年度特別会計予算,内閣,,／,平成30年 1月22日,平成30年 1月22日／予算,平成30年 2月28日／可決,平成30年 2月28日／可決,多数,自由民主党; 公明党,立憲民主党・市民クラブ; 希望の党・無所属クラブ; 無所属の会; 日本共産党; 日本維新の会; 自由党; 社会民主党・市民連合,平成30年 1月22日,平成30年 1月22日／予算,平成30年 2月28日,平成30年 2月28日／予算,平成30年 3月28日／可決,平成30年 3月28日／可決,／
予算の一覧,,196,5,平成三十年度政府関係機関予算,成立,経過,https://www.shugiin.go.jp/internet/itdb_gian.nsf/html/gian/keika/1DC6D12.htm,,,予算,196,5,平成三十年度政府関係機関予算,内閣,,／,平成30年 1月22日,平成30年 1月22日／予算,平成30年 2月28日／可決,平成30年 2月28日／可決,多数,自由民主党; 公明党,立憲民主党・市民クラブ; 希望の党・無所属クラブ; 無所属の会; 日本共産党; 日本維新の会; 自由党; 社会民主党・市民連合,平成30年 1月22日,平成30年 1月22日／予算,平成30年 2月28日,平成30年 2月28日／予算,平成30年 3月28日／可決,平成30年 3月28日／可決,／
予算の一覧,,196,,平成三十年度一般会計予算、平成三十年度特別会計予算及び平成三十年度政府関係機関予算につき撤回のうえ編成替えを求めるの動議,本院議了,経過,https://www.shugiin.go.jp/internet/itdb_gian.nsf/html/gian/keika/1DC80EA.htm,,,予算,196,,平成三十年度一般会計予算、平成三十年度特別会計予算及び平成三十年度政府関係機関予算につき撤回のうえ編成替えを求めるの動議,原口　一博君外六名,,／,平成30年 2月28日,／,／,平成30年 2月28日／否決,少数,立憲民主党・市民クラブ; 希望の党・無所属クラブ; 無所属の会; 日本共産党; 自由党; 社会民主党・市民連合,自由民主党; 公明党; 日本維新の会,,／,,／,／,／,／
条約の一覧,,196,1,盲人、視覚障害者その他の印刷物の判読に障害のある者が発行された著作物を利用する機会を促進するためのマラケシュ条約の締結について承認を求めるの件,両院承認,経過,https://www.shugiin.go.jp/internet/itdb_gian.nsf/html/gian/keika/1DC802A.htm,,,条約,196,1,盲人、視覚障害者その他の印刷物の判読に障害のある者が発行された著作物を利用する機会を促進するためのマラケシュ条約の締結について承認を求めるの件,内閣,,／,平成30年 2月23日,平成30年 3月22日／外務,平成30年 3月28日／承認,平成30年 3月29日／承認,全会一致,自由民主党; 立憲民主党・市民クラブ; 希望の党・無所属クラブ; 公明党; 無所属の会; 日本共産党; 日本維新の会; 自由党; 社会民主党・市民連合,,平成30年 2月23日,／,平成30年 3月29日,平成30年 4月16日／外交防衛,平成30年 4月19日／承認,平成30年 4月25日／承認,／
条約の一覧,,196,2,二千九年の船舶の安全かつ環境上適正な再資源化のための香港国際条約の締結について承認を求めるの件,両院承認,経過,https://www.shugiin.go.jp/internet/itdb_gian.nsf/html/gian/keika/1DC8056.htm,,,条約,196,2,二千九年の船舶の安全かつ環境上適正な再資源化のための香港国際条約の締結について承認を求めるの件,内閣,,／,平成30年 2月23日,平成30年 3月22日／外務,平成30年 3月28日／承認,平成30年 3月29日／承認,全会一致,自由民主党; 立憲民主党・市民クラブ; 希望の党・無所属クラブ; 公明党; 無所属の会; 日本共産党; 日本維新の会; 自由党; 社会民主党・市民連合,,平成30年 2月23日,／,平成30年 3月29日,平成30年 4月16日／外交防衛,平成30年 4月19日／承認,平成30年 4月25日／承認,／
条約の一覧,,196,3,オゾン層を破壊する物質に関するモントリオール議定書の改正の受諾について承認を求めるの件,両院承認,経過,https://www.shugiin.go.jp/internet/itdb_gian.nsf/html/gian/keika/1DC806E.htm,,,条約,196,3,オゾン層を破壊する物質に関するモントリオール議定書の改正の受諾について承認を求めるの件,内閣,,／,平成30年 2月23日,平成30年 3月22日／外務,平成30年 6月 6日／承認,平成30年 6月 7日／承認,全会一致,自由民主党; 立憲民主党・市民クラブ; 国民民主党・無所属クラブ; 公明党; 無所属の会; 日本共産党; 日本維新の会; 自由党; 社会民主党・市民連合; 希望の党,,平成30年 2月23日,／,平成30年 6月 7日,平成30年 6月18日／外交防衛,平成30年 6月28日／承認,平成30年 6月29日／承認,／
条約の一覧,,196,4,税源浸食及び利益移転を防止するための租税条約関連措置を実施するための多数国間条約の締結について承認を求めるの件,両院承認,経過,https://www.shugiin.go.jp/internet/itdb_gian.nsf/html/gian/keika/1DC8506.htm,,,条約,196,4,税源浸食及び利益移転を防止するための租税条約関連措置を実施するための多数国間条約の締結について承認を求めるの件,内閣,,／,平成30年 3月 9日,平成30年 4月12日／外務,平成30年 4月18日／承認,平成30年 4月19日／承認,全会一致,自由民主党; 立憲民主党・市民クラブ; 希望の党・無所属クラブ; 公明党; 無所属の会; 日本共産党; 日本維新の会; 自由党; 社会民主党・市民連合,,平成30年 3月 9日,／,平成30年 4月19日,平成30年 5月14日／外交防衛,平成30年 5月17日／承認,平成30年 5月18日／承認,／
条約の一覧,,196,5,所得に対する租税に関する二重課税の除去並びに脱税及び租税回避の防止のための日本国とリトアニア共和国との間の条約の締結について承認を求めるの件,両院承認,経過,https://www.shugiin.go.jp/internet/itdb_gian.nsf/html/gian/keika/1DC851E.htm,,,条約,196,5,所得に対する租税に関する二重課税の除去並びに脱税及び租税回避の防止のための日本国とリトアニア共和国との間の条約の締結について承認を求めるの件,内閣,,／,平成30年 3月 9日,平成30年 4月 3日／外務,平成30年 4月13日／承認,平成30年 4月17日／承認,多数,自由民主党; 立憲民主党・市民クラブ; 希望の党・無所属クラブ; 公明党; 無所属の会; 日本維新の会; 自由党; 社会民主党・市民連合,日本共産党,平成30年 3月 9日,／,平成30年 4月17日,平成30年 5月 9日／外交防衛,平成30年 5月15日／承認,平成30年 5月16日／承認,／
条約の一覧,,196,6,所得に対する租税に関する二重課税の除去並びに脱税及び租税回避の防止のための日本国とエストニア共和国との間の条約の締結について承認を求めるの件,両院承認,経過,https://www.shugiin.go.jp/internet/itdb_gian.nsf/html/gian/keika/1DC8536.htm,,,条約,196,6,所得に対する租税に関する二重課税の除去並びに脱税及び租税回避の防止のための日本国とエストニア共和国との間の条約の締結について承認を求めるの件,内閣,,／,平成30年 3月 9日,平成30年 4月 3日／外務,平成30年 4月13日／承認,平成30年 4月17日／承認,多数,自由民主党; 立憲民主党・市民クラブ; 希望の党・無所属クラブ; 公明党; 無所属の会; 日本維新の会; 自由党; 社会民主党・市民連合,日本共産党,平成30年 3月 9日,／,平成30年 4月17日,平成30年 5月 9日／外交防衛,平成30年 5月15日／承認,平成30年 5月16日／承認,／
条約の一覧,,196,7,所得に対する租税に関する二重課税の除去並びに脱税及び租税回避の防止のための日本国政府とロシア連邦政府との間の条約の締結について承認を求めるの件,両院承認,経過,https://www.shugiin.go.jp/internet/itdb_gian.nsf/html/gian/keika/1DC854E.htm,,,条約,196,7,所得に対する租税に関する二重課税の除去並びに脱税及び租税回避の防止のための日本国政府とロシア連邦政府との間の条約の締結について承認を求めるの件,内閣,,／,平成30年 3月 9日,平成30年 4月 3日／外務,平成30年 4月13日／承認,平成30年 4月17日／承認,多数,自由民主党; 立憲民主党・市民クラブ; 希望の党・無所属クラブ; 公明党; 無所属の会; 日本維新の会; 自由党; 社会民主党・市民連合,日本共産党,平成30年 3月 9日,／,平成30年 4月17日,平成30年 5月 9日／外交防衛,平成30年 5月15日／承認,平成30年 5月16日／承認,／
条約の一覧,,196,8,所得に対する租税に関する二重課税の除去並びに脱税及び租税回避の防止のための日本国とデンマーク王国との間の条約の締結について承認を求めるの件,両院承認,経過,https://www.shugiin.go.jp/internet/itdb_gian.nsf/html/gian/keika/1DC8566.htm,,,条約,196,8,所得に対する租税に関する二重課税の除去並びに脱税及び租税回避の防止のための日本国とデンマーク王国との間の条約の締結について承認を求めるの件,内閣,,／,平成30年 3月 9日,平成30年 4月12日／外務,平成30年 4月18日／承認,平成30年 4月19日／承認,多数,自由民主党; 立憲民主党・市民クラブ; 希望の党・無所属クラブ; 公明党; 無所属の会; 日本維新の会; 自由党; 社会民主党・市民連合,日本共産党,平成30年 3月 9日,／,平成30年 4月19日,平成30年 5月14日／外交防衛,平成30年 5月17日／承認,平成30年 5月18日／承認,／
条約の一覧,,196,9,所得に対する租税に関する二重課税の除去並びに脱税及び租税回避の防止のための日本国とアイスランドとの間の条約の締結について承認を求めるの件,両院承認,経過,https://www.shugiin.go.jp/internet/itdb_gian.nsf/html/gian/keika/1DC857E.htm,,,条約,196,9,所得に対する租税に関する二重課税の除去並びに脱税及び租税回避の防止のための日本国とアイスランドとの間の条約の締結について承認を求めるの件,内閣,,／,平成30年 3月 9日,平成30年 4月12日／外務,平成30年 4月18日／承認,平成30年 4月19日／承認,多数,自由民主党; 立憲民主党・市民クラブ; 希望の党・無所属クラブ; 公明党; 無所属の会; 日本維新の会; 自由党; 社会民主党・市民連合,日本共産党,平成30年 3月 9日,／,平成30年 4月19日,平成30年 5月14日／外交防衛,平成30年 5月17日／承認,平成30年 5月18日／承認,／
条約の一覧,,196,10,投資の自由化、促進及び保護に関する日本国とアルメニア共和国との間の協定の締結について承認を求めるの件,両院承認,経過,https://www.shugiin.go.jp/internet/itdb_gian.nsf/html/gian/keika/1DC8596.htm,,,条約,196,10,投資の自由化、促進及び保護に関する日本国とアルメニア共和国との間の協定の締結について承認を求めるの件,内閣,,／,平成30年 3月 9日,平成30年 4月 3日／外務,平成30年 4月13日／承認,平成30年 4月17日／承認,多数,自由民主党; 立憲民主党・市民クラブ; 希望の党・無所属クラブ; 公明党; 無所属の会; 日本維新の会; 自由党; 社会民主党・市民連合,日本共産党,平成30年 3月 9日,／,平成30年 4月17日,平成30年 5月 9日／外交防衛,平成30年 5月15日／承認,平成30年 5月16日／承認,／
条約の一覧,,196,11,環太平洋パートナーシップに関する包括的及び先進的な協定の締結について承認を求めるの件,両院承認,経過,https://www.shugiin.go.jp/internet/itdb_gian.nsf/html/gian/keika/1DC88D2.htm,,,条約,196,11,環太平洋パートナーシップに関する包括的及び先進的な協定の締結について承認を求めるの件,内閣,,／,平成30年 3月27日,平成30年 4月17日／外務,平成30年 5月18日／承認,平成30年 5月18日／承認,多数,自由民主党; 公明党; 日本維新の会; 希望の党,立憲民主党・市民クラブ; 国民民主党・無所属クラブ; 無所属の会; 日本共産党; 自由党; 社会民主党・市民連合,平成30年 3月27日,／,平成30年 5月18日,平成30年 6月 1日／外交防衛,平成30年 6月12日／承認,平成30年 6月13日／承認,／
承認の一覧,,196,1,放送法第七十条第二項の規定に基づき、承認を求めるの件,両院承認,経過,https://www.shugiin.go.jp/internet/itdb_gian.nsf/html/gian/keika/1DC7E2A.htm,,,承認,196,1,放送法第七十条第二項の規定に基づき、承認を求めるの件,内閣,,／,平成30年 2月 9日,平成30年 3月20日／総務,平成30年 3月22日／承認,平成30年 3月23日／承認,全会一致,自由民主党; 立憲民主党・市民クラブ; 希望の党・無所属クラブ; 公明党; 無所属の会; 日本共産党; 日本維新の会; 自由党; 社会民主党・市民連合,,平成30年 2月 9日,／,平成30年 3月23日,平成30年 3月28日／総務,平成30年 3月29日／承認,平成30年 3月30日／承認,／
承諾の一覧,,195,,平成二十八年度一般会計熊本地震復旧等予備費使用総調書及び各省各庁所管使用調書,両院承諾,経過,https://www.shugiin.go.jp/internet/itdb_gian.nsf/html/gian/keika/1DC6AFE.htm,,,承諾,195,,平成二十八年度一般会計熊本地震復旧等予備費使用総調書及び各省各庁所管使用調書,内閣,,／,,平成30年 1月22日／決算行政監視,平成30年 5月17日／承諾,平成30年 5月18日／承諾,全会一致,自由民主党; 立憲民主党・市民クラブ; 国民民主党・無所属クラブ; 公明党; 無所属の会; 日本共産党; 日本維新の会; 自由党; 社会民主党・市民連合; 希望の党,,,／,平成30年 5月18日,平成30年 6月 6日／決算,平成30年 6月11日／承諾,平成30年 6月13日／承諾,／
承諾の一覧,,195,,平成二十八年度一般会計予備費使用総調書及び各省各庁所管使用調書,両院承諾,経過,https://www.shugiin.go.jp/internet/itdb_gian.nsf/html/gian/keika/1DC6B02.htm,,,承諾,195,,平成二十八年度一般会計予備費使用総調書及び各省各庁所管使用調書,内閣,,／,,平成30年 1月22日／決算行政監視,平成30年 5月17日／承諾,平成30年 5月18日／承諾,多数,自由民主党; 立憲民主党・市民クラブ; 国民民主党・無所属クラブ; 公明党; 無所属の会; 日本維新の会; 自由党; 社会民主党・市民連合; 希望の党,日本共産党,,／,平成30年 5月18日,平成30年 6月 6日／決算,平成30年 6月11日／承諾,平成30年 6月13日／承諾,／
承諾の一覧,,195,,平成二十八年度特別会計予算総則第二十条第一項の規定による経費増額総調書及び各省各庁所管経費増額調書,両院承諾,経過,https://www.shugiin.go.jp/internet/itdb_gian.nsf/html/gian/keika/1DC6B06.htm,,,承諾,195,,平成二十八年度特別会計予算総則第二十条第一項の規定による経費増額総調書及び各省各庁所管経費増額調書,内閣,,／,,平成30年 1月22日／決算行政監視,平成30年 5月17日／承諾,平成30年 5月18日／承諾,全会一致,自由民主党; 立憲民主党・市民クラブ; 国民民主党・無所属クラブ; 公明党; 無所属の会; 日本共産党; 日本維新の会; 自由党; 社会民主党・市民連合; 希望の党,,,／,平成30年 5月18日,平成30年 6月 6日／決算,平成30年 6月11日／承諾,平成30年 6月13日／承諾,／
承諾の一覧,,196,,平成二十九年度一般会計予備費使用総調書及び各省各庁所管使用調書（その１）,衆議院で閉会中審査,経過,https://www.shugiin.go.jp/internet/itdb_gian.nsf/html/gian/keika/1DC8886.htm,,,承諾,196,,平成二十九年度一般会計予備費使用総調書及び各省各庁所管使用調書（その１）,内閣,,／,平成30年 3月16日,平成30年 7月19日／決算行政監視,／,／閉会中審査,,,,平成30年 3月16日,／,,／,／,／,／
承諾の一覧,,196,,平成二十九年度一般会計予備費使用総調書及び各省各庁所管使用調書（その２）,衆議院で閉会中審査,経過,https://www.shugiin.go.jp/internet/itdb_gian.nsf/html/gian/keika/1DC8AF6.htm,,,承諾,196,,平成二十九年度一般会計予備費使用総調書及び各省各庁所管使用調書（その２）,内閣,,／,平成30年 5月18日,平成30年 7月19日／決算行政監視,／,／閉会中審査,,,,平成30年 5月18日,／,,／,／,／,／
決算その他,決算,195,,平成二十八年度一般会計歳入歳出決算,衆議院で閉会中審査,経過,https://www.shugiin.go.jp/internet/itdb_gian.nsf/html/gian/keika/1DC6AB2.htm,,,決算,195,,平成二十八年度一般会計歳入歳出決算,内閣,,／,,平成30年 1月22日／決算行政監視,／,／閉会中審査,,,,,／,,／,／,／,／
決算その他,決算,195,,平成二十八年度特別会計歳入歳出決算,衆議院で閉会中審査,経過,https://www.shugiin.go.jp/internet/itdb_gian.nsf/html/gian/keika/1DC6ABA.htm,,,決算,195,,平成二十八年度特別会計歳入歳出決算,内閣,,／,,平成30年 1月22日／決算行政監視,／,／閉会中審査,,,,,／,,／,／,／,／
決算その他,決算,195,,平成二十八年度国税収納金整理資金受払計算書,衆議院で閉会中審査,経過,https://www.shugiin.go.jp/internet/itdb_gian.nsf/html/gian/keika/1DC6AB6.htm,,,決算,195,,平成二十八年度国税収納金整理資金受払計算書,内閣,,／,,平成30年 1月22日／決算行政監視,／,／閉会中審査,,,,,／,,／,／,／,／
決算その他,決算,195,,平成二十八年度政府関係機関決算書,衆議院で閉会中審査,経過,https://www.shugiin.go.jp/internet/itdb_gian.nsf/html/gian/keika/1DC6ABE.htm,,,決算,195,,平成二十八年度政府関係機関決算書,内閣,,／,,平成30年 1月22日／決算行政監視,／,／閉会中審査,,,,,／,,／,／,／,／
決算その他,国有財産,195,,平成二十八年度国有財産増減及び現在額総計算書,衆議院で閉会中審査,経過,https://www.shugiin.go.jp/internet/itdb_gian.nsf/html/gian/keika/1DC6AE6.htm,,,国有財産,195,,平成二十八年度国有財産増減及び現在額総計算書,内閣,,／,,平成30年 1月22日／決算行政監視,／,／閉会中審査,,,,,／,,／,／,／,／
