閣法の一覧,,196,2,国際観光旅客税法案,成立,経過,https://www.shugiin.go.jp/internet/itdb_gian.nsf/html/gian/keika/1DC6D1E.htm,本文,https://www.shugiin.go.jp/internet/itdb_gian.nsf/html/gian/honbun/g19609002.htm,閣法,196,2,国際観光旅客税法案,内閣,,／,平成30年 2月 2日,平成30年 2月13日／財務金融,平成30年 3月 2日／可決,平成30年 3月 9日／可決,多数,自由民主党; 公明党; 日本維新の会,,平成30年 2月 2日,／,平成30年 3月 9日,平成30年 4月 4日／財政金融,平成30年 4月10日／可決,平成30年 4月11日／可決,平成30年 4月18日／16
閣法の一覧,,196,3,道路法等の一部を改正する法律案,成立,経過,https://www.shugiin.go.jp/internet/itdb_gian.nsf/html/gian/keika/1DC6D22.htm,本文,https://www.shugiin.go.jp/internet/itdb_gian.nsf/html/gian/honbun/g19609003.htm,閣法,196,3,道路法等の一部を改正する法律案,内閣,,／,平成30年 2月 2日,平成30年 3月 5日／国土交通,平成30年 3月16日／可決,平成30年 3月22日／可決,多数,自由民主党; 立憲民主党・市民クラブ; 希望の党・無所属クラブ; 公明党; 無所属の会; 日本維新の会; 自由党; 社会民主党・市民連合,日本共産党,平成30年 2月 2日,／,平成30年 3月22日,平成30年 3月26日／国土交通,平成30年 3月29日／可決,平成30年 3月30日／可決,平成30年 3月31日／6
閣法の一覧,,196,4,外国人観光旅客の旅行の容易化等の促進による国際観光の振興に関する法律の一部を改正する法律案,成立,経過,https://www.shugiin.go.jp/internet/itdb_gian.nsf/html/gian/keika/1DC6D26.htm,本文及び修正案,https://www.shugiin.go.jp/internet/itdb_gian.nsf/html/gian/honbun/g19609004.htm,閣法,196,4,外国人観光旅客の旅行の容易化等の促進による国際観光の振興に関する法律の一部を改正する法律案,内閣,,／,平成30年 2月 2日,平成30年 3月15日／国土交通,平成30年 3月20日／可決,平成30年 3月22日／可決,多数,自由民主党; 希望の党・無所属クラブ; 公明党; 無所属の会; 日本維新の会; 社会民主党・市民連合,立憲民主党・市民クラブ; 日本共産党; 自由党,平成30年 2月 2日,／,平成30年 3月22日,平成30年 3月29日／国土交通,平成30年 4月 3日／修正,平成30年 4月 4日／修正,平成30年 4月18日／15
閣法の一覧,,196,4,外国人観光旅客の旅行の容易化等の促進による国際観光の振興に関する法律の一部を改正する法律案,参議院回付案（同意）,経過,https://www.shugiin.go.jp/internet/itdb_gian.nsf/html/gian/keika/1DC893A.htm,,,閣法,196,4,外国人観光旅客の旅行の容易化等の促進による国際観光の振興に関する法律の一部を改正する法律案,,,／,平成30年 4月 4日,／,／,平成30年 4月10日／同意,多数,自由民主党; 希望の党・無所属クラブ; 公明党; 無所属の会; 日本維新の会; 社会民主党・市民連合,立憲民主党・市民クラブ; 日本共産党; 自由党,,／,,／,／,／,／
閣法の一覧,,196,5,地域における大学の振興及び若者の雇用機会の創出による若者の修学及び就業の促進に関する法律案,成立,経過,https://www.shugiin.go.jp/internet/itdb_gian.nsf/html/gian/keika/1DC7D36.htm,本文,https://www.shugiin.go.jp/internet/itdb_gian.nsf/html/gian/honbun/g19609005.htm,閣法,196,5,地域における大学の振興及び若者の雇用機会の創出による若者の修学及び就業の促進に関する法律案,内閣,,／,平成30年 2月 6日,平成30年 3月16日／地方創生に関する特別,平成30年 3月22日／可決,平成30年 3月23日／可決,多数,自由民主党; 立憲民主党・市民クラブ; 希望の党・無所属クラブ; 公明党; 日本維新の会,無所属の会; 日本共産党; 自由党; 社会民主党・市民連合,平成30年 2月 6日,／,平成30年 3月23日,平成30年 5月16日／内閣,平成30年 5月24日／可決,平成30年 5月25日／可決,平成30年 6月 1日／37
閣法の一覧,,196,6,子ども・子育て支援法の一部を改正する法律案,成立,経過,https://www.shugiin.go.jp/internet/itdb_gian.nsf/html/gian/keika/1DC7D3A.htm,本文,https://www.shugiin.go.jp/internet/itdb_gian.nsf/html/gian/honbun/g19609006.htm,閣法,196,6,子ども・子育て支援法の一部を改正する法律案,内閣,,／,平成30年 2月 6日,平成30年 3月 9日／内閣,平成30年 3月15日／可決,平成30年 3月16日／可決,全会一致,自由民主党; 公明党; 日本維新の会,,平成30年 2月 6日,／,平成30年 3月16日,平成30年 3月23日／内閣,平成30年 3月29日／可決,平成30年 3月30日／可決,平成30年 3月31日／12
閣法の一覧,,196,7,地域再生法の一部を改正する法律案,成立,経過,https://www.shugiin.go.jp/internet/itdb_gian.nsf/html/gian/keika/1DC7D3E.htm,本文,https://www.shugiin.go.jp/internet/itdb_gian.nsf/html/gian/honbun/g19609007.htm,閣法,196,7,地域再生法の一部を改正する法律案,内閣,,／,平成30年 2月 6日,平成30年 3月16日／地方創生に関する特別,平成30年 3月22日／可決,平成30年 3月23日／可決,多数,自由民主党; 立憲民主党・市民クラブ; 希望の党・無所属クラブ; 公明党; 無所属の会; 日本維新の会,日本共産党; 自由党; 社会民主党・市民連合,平成30年 2月 6日,／,平成30年 3月23日,平成30年 5月16日／内閣,平成30年 5月24日／可決,平成30年 5月25日／可決,平成30年 6月 1日／38
閣法の一覧,,196,8,地方税法等の一部を改正する法律案,成立,経過,https://www.shugiin.go.jp/internet/itdb_gian.nsf/html/gian/keika/1DC7D42.htm,本文,https://www.shugiin.go.jp/internet/itdb_gian.nsf/html/gian/honbun/g19609008.htm,閣法,196,8,地方税法等の一部を改正する法律案,内閣,,／,平成30年 2月 6日,平成30年 2月15日／総務,平成30年 2月28日／可決,平成30年 2月28日／可決,多数,自由民主党; 公明党; 日本維新の会,立憲民主党・市民クラブ; 希望の党・無所属クラブ; 無所属の会; 日本共産党; 自由党; 社会民主党・市民連合,平成30年 2月 6日,／,平成30年 2月28日,平成30年 3月16日／総務,平成30年 3月28日／可決,平成30年 3月28日／可決,平成30年 3月31日／3
閣法の一覧,,196,9,地方交付税法及び特別会計に関する法律の一部を改正する法律案,成立,経過,https://www.shugiin.go.jp/internet/itdb_gian.nsf/html/gian/keika/1DC7D46.htm,本文,https://www.shugiin.go.jp/internet/itdb_gian.nsf/html/gian/honbun/g19609009.htm,閣法,196,9,地方交付税法及び特別会計に関する法律の一部を改正する法律案,内閣,,／,平成30年 2月 6日,平成30年 2月15日／総務,平成30年 2月28日／可決,平成30年 2月28日／可決,多数,自由民主党; 立憲民主党・市民クラブ; 希望の党・無所属クラブ; 公明党; 日本維新の会,無所属の会; 日本共産党; 自由党; 社会民主党・市民連合,平成30年 2月 6日,／,平成30年 2月28日,平成30年 3月16日／総務,平成30年 3月28日／可決,平成30年 3月28日／可決,平成30年 3月31日／4
閣法の一覧,,196,10,裁判所職員定員法の一部を改正する法律案,成立,経過,https://www.shugiin.go.jp/internet/itdb_gian.nsf/html/gian/keika/1DC7D4A.htm,本文,https://www.shugiin.go.jp/internet/itdb_gian.nsf/html/gian/honbun/g19609010.htm,閣法,196,10,裁判所職員定員法の一部を改正する法律案,内閣,,／,平成30年 2月 6日,平成30年 3月27日／法務,平成30年 3月30日／可決,平成30年 4月 3日／可決,多数,自由民主党; 立憲民主党・市民クラブ; 公明党; 無所属の会; 日本維新の会; 自由党; 社会民主党・市民連合,希望の党・無所属クラブ; 日本共産党,平成30年 2月 6日,／,平成30年 4月 3日,平成30年 4月 4日／法務,平成30年 4月10日／可決,平成30年 4月11日／可決,平成30年 4月18日／14
閣法の一覧,,196,11,人事訴訟法等の一部を改正する法律案,成立,経過,https://www.shugiin.go.jp/internet/itdb_gian.nsf/html/gian/keika/1DC7D4E.htm,本文,https://www.shugiin.go.jp/internet/itdb_gian.nsf/html/gian/honbun/g19609011.htm,閣法,196,11,人事訴訟法等の一部を改正する法律案,内閣,,／,平成30年 2月 6日,平成30年 4月 3日／法務,平成30年 4月 6日／可決,平成30年 4月10日／可決,全会一致,自由民主党; 立憲民主党・市民クラブ; 希望の党・無所属クラブ; 公明党; 無所属の会; 日本共産党; 日本維新の会; 自由党; 社会民主党・市民連合,,平成30年 2月 6日,／,平成30年 4月10日,平成30年 4月11日／法務,平成30年 4月17日／可決,平成30年 4月18日／可決,平成30年 4月25日／20
閣法の一覧,,196,12,商法及び国際海上物品運送法の一部を改正する法律案,成立,経過,https://www.shugiin.go.jp/internet/itdb_gian.nsf/html/gian/keika/1DC7D52.htm,本文,https://www.shugiin.go.jp/internet/itdb_gian.nsf/html/gian/honbun/g19609012.htm,閣法,196,12,商法及び国際海上物品運送法の一部を改正する法律案,内閣,,／,平成30年 2月 6日,平成30年 4月12日／法務,平成30年 4月18日／可決,平成30年 4月19日／可決,全会一致,自由民主党; 立憲民主党・市民クラブ; 希望の党・無所属クラブ; 公明党; 無所属の会; 日本共産党; 日本維新の会; 自由党; 社会民主党・市民連合,,平成30年 2月 6日,／,平成30年 4月19日,平成30年 5月14日／法務,平成30年 5月17日／可決,平成30年 5月18日／可決,平成30年 5月25日／29
閣法の一覧,,196,13,関税定率法等の一部を改正する法律案,成立,経過,https://www.shugiin.go.jp/internet/itdb_gian.nsf/html/gian/keika/1DC7D56.htm,本文,https://www.shugiin.go.jp/internet/itdb_gian.nsf/html/gian/honbun/g19609013.htm,閣法,196,13,関税定率法等の一部を改正する法律案,内閣,,／,平成30年 2月 6日,平成30年 3月15日／財務金融,平成30年 3月20日／可決,平成30年 3月22日／可決,全会一致,自由民主党; 立憲民主党・市民クラブ; 希望の党・無所属クラブ; 公明党; 無所属の会; 日本共産党; 日本維新の会; 自由党; 社会民主党・市民連合,,平成30年 2月 6日,／,平成30年 3月22日,平成30年 3月28日／財政金融,平成30年 3月29日／可決,平成30年 3月30日／可決,平成30年 3月31日／8
閣法の一覧,,196,14,駐留軍関係離職者等臨時措置法及び国際協定の締結等に伴う漁業離職者に関する臨時措置法の一部を改正する法律案,成立,経過,https://www.shugiin.go.jp/internet/itdb_gian.nsf/html/gian/keika/1DC7D5A.htm,本文,https://www.shugiin.go.jp/internet/itdb_gian.nsf/html/gian/honbun/g19609014.htm,閣法,196,14,駐留軍関係離職者等臨時措置法及び国際協定の締結等に伴う漁業離職者に関する臨時措置法の一部を改正する法律案,内閣,,／,平成30年 2月 6日,平成30年 3月22日／厚生労働,平成30年 3月28日／可決,平成30年 3月29日／可決,全会一致,自由民主党; 立憲民主党・市民クラブ; 希望の党・無所属クラブ; 公明党; 無所属の会; 日本共産党; 日本維新の会; 自由党; 社会民主党・市民連合,,平成30年 2月 6日,／,平成30年 3月29日,平成30年 4月 2日／厚生労働,平成30年 4月 5日／可決,平成30年 4月 6日／可決,平成30年 4月13日／13
閣法の一覧,,196,15,水産加工業施設改良資金融通臨時措置法の一部を改正する法律案,成立,経過,https://www.shugiin.go.jp/internet/itdb_gian.nsf/html/gian/keika/1DC7D5E.htm,本文,https://www.shugiin.go.jp/internet/itdb_gian.nsf/html/gian/honbun/g19609015.htm,閣法,196,15,水産加工業施設改良資金融通臨時措置法の一部を改正する法律案,内閣,,／,平成30年 2月 6日,平成30年 3月20日／農林水産,平成30年 3月22日／可決,平成30年 3月23日／可決,全会一致,自由民主党; 立憲民主党・市民クラブ; 希望の党・無所属クラブ; 公明党; 無所属の会; 日本共産党; 日本維新の会; 自由党; 社会民主党・市民連合,,平成30年 2月 6日,／,平成30年 3月23日,平成30年 3月26日／農林水産,平成30年 3月29日／可決,平成30年 3月30日／可決,平成30年 3月31日／9
閣法の一覧,,196,16,公害健康被害の補償等に関する法律の一部を改正する法律案,成立,経過,https://www.shugiin.go.jp/internet/itdb_gian.nsf/html/gian/keika/1DC7D62.htm,本文,https://www.shugiin.go.jp/internet/itdb_gian.nsf/html/gian/honbun/g19609016.htm,閣法,196,16,公害健康被害の補償等に関する法律の一部を改正する法律案,内閣,,／,平成30年 2月 6日,平成30年 3月 5日／環境,平成30年 3月20日／可決,平成30年 3月22日／可決,全会一致,自由民主党; 立憲民主党・市民クラブ; 希望の党・無所属クラブ; 公明党; 無所属の会; 日本共産党; 日本維新の会; 自由党; 社会民主党・市民連合,,平成30年 2月 6日,／,平成30年 3月22日,平成30年 3月26日／環境,平成30年 3月29日／可決,平成30年 3月30日／可決,平成30年 3月31日／11
閣法の一覧,,196,17,株式会社地域経済活性化支援機構法の一部を改正する法律案,成立,経過,https://www.shugiin.go.jp/internet/itdb_gian.nsf/html/gian/keika/1DC7D66.htm,本文,https://www.shugiin.go.jp/internet/itdb_gian.nsf/html/gian/honbun/g19609017.htm,閣法,196,17,株式会社地域経済活性化支援機構法の一部を改正する法律案,内閣,,／,平成30年 2月 9日,平成30年 4月 3日／内閣,平成30年 4月 6日／可決,平成30年 4月10日／可決,多数,自由民主党; 立憲民主党・市民クラブ; 希望の党・無所属クラブ; 公明党; 無所属の会; 日本維新の会,日本共産党; 自由党; 社会民主党・市民連合,平成30年 2月 9日,／,平成30年 4月10日,平成30年 4月11日／内閣,平成30年 5月15日／可決,平成30年 5月16日／可決,平成30年 5月23日／27
閣法の一覧,,196,18,民間資金等の活用による公共施設等の整備等の促進に関する法律の一部を改正する法律案,成立,経過,https://www.shugiin.go.jp/internet/itdb_gian.nsf/html/gian/keika/1DC7D6A.htm,本文及び修正案,https://www.shugiin.go.jp/internet/itdb_gian.nsf/html/gian/honbun/g19609018.htm,閣法,196,18,民間資金等の活用による公共施設等の整備等の促進に関する法律の一部を改正する法律案,内閣,,／,平成30年 2月 9日,平成30年 4月12日／内閣,平成30年 5月11日／可決,平成30年 5月15日／可決,多数,自由民主党; 公明党; 日本維新の会; 希望の党,立憲民主党・市民クラブ; 国民民主党・無所属クラブ; 無所属の会; 日本共産党; 自由党; 社会民主党・市民連合,平成30年 2月 9日,／,平成30年 5月15日,平成30年 6月 1日／内閣,平成30年 6月12日／可決,平成30年 6月13日／可決,平成30年 6月20日／60
閣法の一覧,,196,19,在外公館の名称及び位置並びに在外公館に勤務する外務公務員の給与に関する法律の一部を改正する法律案,成立,経過,https://www.shugiin.go.jp/internet/itdb_gian.nsf/html/gian/keika/1DC7D82.htm,本文,https://www.shugiin.go.jp/internet/itdb_gian.nsf/html/gian/honbun/g19609019.htm,閣法,196,19,在外公館の名称及び位置並びに在外公館に勤務する外務公務員の給与に関する法律の一部を改正する法律案,内閣,,／,平成30年 2月 9日,平成30年 3月 9日／外務,平成30年 3月14日／可決,平成30年 3月16日／可決,全会一致,自由民主党; 公明党; 日本維新の会,,平成30年 2月 9日,／,平成30年 3月16日,平成30年 3月26日／外交防衛,平成30年 3月29日／可決,平成30年 3月30日／可決,平成30年 3月31日／2
閣法の一覧,,196,20,生活困窮者等の自立を促進するための生活困窮者自立支援法等の一部を改正する法律案,成立,経過,https://www.shugiin.go.jp/internet/itdb_gian.nsf/html/gian/keika/1DC7D86.htm,本文,https://www.shugiin.go.jp/internet/itdb_gian.nsf/html/gian/honbun/g19609020.htm,閣法,196,20,生活困窮者等の自立を促進するための生活困窮者自立支援法等の一部を改正する法律案,内閣,,／,平成30年 2月 9日,平成30年 3月30日／厚生労働,平成30年 4月25日／可決,平成30年 4月27日／可決,全会一致,自由民主党; 公明党; 日本維新の会,,平成30年 2月 9日,／,平成30年 4月27日,平成30年 5月18日／厚生労働,平成30年 5月31日／可決,平成30年 6月 1日／可決,平成30年 6月 8日／44
閣法の一覧,,196,21,生産性向上特別措置法案,成立,経過,https://www.shugiin.go.jp/internet/itdb_gian.nsf/html/gian/keika/1DC7D8A.htm,本文,https://www.shugiin.go.jp/internet/itdb_gian.nsf/html/gian/honbun/g19609021.htm,閣法,196,21,生産性向上特別措置法案,内閣,,／,平成30年 2月 9日,平成30年 4月 3日／経済産業,平成30年 4月13日／可決,平成30年 4月17日／可決,多数,自由民主党; 立憲民主党・市民クラブ; 希望の党・無所属クラブ; 公明党; 無所属の会; 日本維新の会; 自由党,日本共産党; 社会民主党・市民連合,平成30年 2月 9日,／,平成30年 4月17日,平成30年 4月18日／経済産業,平成30年 5月15日／可決,平成30年 5月16日／可決,平成30年 5月23日／25
閣法の一覧,,196,22,産業競争力強化法等の一部を改正する法律案,成立,経過,https://www.shugiin.go.jp/internet/itdb_gian.nsf/html/gian/keika/1DC7D8E.htm,本文,https://www.shugiin.go.jp/internet/itdb_gian.nsf/html/gian/honbun/g19609022.htm,閣法,196,22,産業競争力強化法等の一部を改正する法律案,内閣,,／,平成30年 2月 9日,平成30年 4月 3日／経済産業,平成30年 4月13日／可決,平成30年 4月17日／可決,多数,自由民主党; 立憲民主党・市民クラブ; 希望の党・無所属クラブ; 公明党; 無所属の会; 日本維新の会; 自由党,日本共産党; 社会民主党・市民連合,平成30年 2月 9日,／,平成30年 4月17日,平成30年 4月18日／経済産業,平成30年 5月15日／可決,平成30年 5月16日／可決,平成30年 5月23日／26
閣法の一覧,,196,23,高齢者、障害者等の移動等の円滑化の促進に関する法律の一部を改正する法律案,成立,経過,https://www.shugiin.go.jp/internet/itdb_gian.nsf/html/gian/keika/1DC7DBE.htm,本文及び修正案,https://www.shugiin.go.jp/internet/itdb_gian.nsf/html/gian/honbun/g19609023.htm,閣法,196,23,高齢者、障害者等の移動等の円滑化の促進に関する法律の一部を改正する法律案,内閣,,／,平成30年 2月 9日,平成30年 4月 5日／国土交通,平成30年 4月18日／可決,平成30年 4月19日／可決,全会一致,自由民主党; 立憲民主党・市民クラブ; 希望の党・無所属クラブ; 公明党; 無所属の会; 日本共産党; 日本維新の会; 自由党; 社会民主党・市民連合,,平成30年 2月 9日,／,平成30年 4月19日,平成30年 5月11日／国土交通,平成30年 5月17日／可決,平成30年 5月18日／可決,平成30年 5月25日／32
閣法の一覧,,196,24,都市再生特別措置法等の一部を改正する法律案,成立,経過,https://www.shugiin.go.jp/internet/itdb_gian.nsf/html/gian/keika/1DC7DD6.htm,本文,https://www.shugiin.go.jp/internet/itdb_gian.nsf/html/gian/honbun/g19609024.htm,閣法,196,24,都市再生特別措置法等の一部を改正する法律案,内閣,,／,平成30年 2月 9日,平成30年 4月 3日／国土交通,平成30年 4月 6日／可決,平成30年 4月10日／可決,多数,自由民主党; 立憲民主党・市民クラブ; 希望の党・無所属クラブ; 公明党; 無所属の会; 日本維新の会; 自由党,日本共産党; 社会民主党・市民連合,平成30年 2月 9日,／,平成30年 4月10日,平成30年 4月11日／国土交通,平成30年 4月17日／可決,平成30年 4月18日／可決,平成30年 4月25日／22
閣法の一覧,,196,25,防衛省設置法及び自衛隊法の一部を改正する法律案,成立,経過,https://www.shugiin.go.jp/internet/itdb_gian.nsf/html/gian/keika/1DC7E02.htm,本文,https://www.shugiin.go.jp/internet/itdb_gian.nsf/html/gian/honbun/g19609025.htm,閣法,196,25,防衛省設置法及び自衛隊法の一部を改正する法律案,内閣,,／,平成30年 2月 9日,平成30年 3月20日／安全保障,平成30年 3月22日／可決,平成30年 3月23日／可決,多数,自由民主党; 立憲民主党・市民クラブ; 希望の党・無所属クラブ; 公明党; 無所属の会; 日本維新の会; 自由党,日本共産党; 社会民主党・市民連合,平成30年 2月 9日,／,平成30年 3月23日,平成30年 4月 2日／外交防衛,平成30年 4月12日／可決,平成30年 4月13日／可決,平成30年 4月20日／17
閣法の一覧,,196,26,文部科学省設置法の一部を改正する法律案,成立,経過,https://www.shugiin.go.jp/internet/itdb_gian.nsf/html/gian/keika/1DC7F8E.htm,本文,https://www.shugiin.go.jp/internet/itdb_gian.nsf/html/gian/honbun/g19609026.htm,閣法,196,26,文部科学省設置法の一部を改正する法律案,内閣,,／,平成30年 2月16日,平成30年 5月15日／文部科学,平成30年 5月25日／可決,平成30年 5月29日／可決,多数,自由民主党; 立憲民主党・市民クラブ; 国民民主党・無所属クラブ; 公明党; 無所属の会; 日本維新の会; 自由党; 社会民主党・市民連合; 希望の党,日本共産党,平成30年 2月16日,／,平成30年 5月29日,平成30年 6月 6日／文教科学,平成30年 6月 7日／可決,平成30年 6月 8日／可決,平成30年 6月15日／51
閣法の一覧,,196,27,気候変動適応法案,成立,経過,https://www.shugiin.go.jp/internet/itdb_gian.nsf/html/gian/keika/1DC7FA6.htm,本文及び修正案,https://www.shugiin.go.jp/internet/itdb_gian.nsf/html/gian/honbun/g19609027.htm,閣法,196,27,気候変動適応法案,内閣,,／,平成30年 2月20日,平成30年 4月10日／環境,平成30年 5月18日／可決,平成30年 5月22日／可決,全会一致,自由民主党; 立憲民主党・市民クラブ; 国民民主党・無所属クラブ; 公明党; 無所属の会; 日本共産党; 日本維新の会; 自由党; 社会民主党・市民連合; 希望の党,,平成30年 2月20日,／,平成30年 5月22日,平成30年 5月23日／環境,平成30年 6月 5日／可決,平成30年 6月 6日／可決,平成30年 6月13日／50
閣法の一覧,,196,28,著作権法の一部を改正する法律案,成立,経過,https://www.shugiin.go.jp/internet/itdb_gian.nsf/html/gian/keika/1DC7FE6.htm,本文,https://www.shugiin.go.jp/internet/itdb_gian.nsf/html/gian/honbun/g19609028.htm,閣法,196,28,著作権法の一部を改正する法律案,内閣,,／,平成30年 2月23日,平成30年 4月 3日／文部科学,平成30年 4月13日／可決,平成30年 4月17日／可決,多数,自由民主党; 立憲民主党・市民クラブ; 希望の党・無所属クラブ; 公明党; 無所属の会; 日本維新の会; 自由党; 社会民主党・市民連合,日本共産党,平成30年 2月23日,／,平成30年 4月17日,平成30年 5月 9日／文教科学,平成30年 5月17日／可決,平成30年 5月18日／可決,平成30年 5月25日／30
閣法の一覧,,196,29,学校教育法等の一部を改正する法律案,成立,経過,https://www.shugiin.go.jp/internet/itdb_gian.nsf/html/gian/keika/1DC7FFE.htm,本文,https://www.shugiin.go.jp/internet/itdb_gian.nsf/html/gian/honbun/g19609029.htm,閣法,196,29,学校教育法等の一部を改正する法律案,内閣,,／,平成30年 2月23日,平成30年 4月12日／文部科学,平成30年 5月 9日／可決,平成30年 5月10日／可決,全会一致,自由民主党; 立憲民主党・市民クラブ; 国民民主党・無所属クラブ; 公明党; 無所属の会; 日本共産党; 日本維新の会; 自由党; 社会民主党・市民連合; 希望の党,,平成30年 2月23日,／,平成30年 5月10日,平成30年 5月21日／文教科学,平成30年 5月24日／可決,平成30年 5月25日／可決,平成30年 6月 1日／39
閣法の一覧,,196,30,不正競争防止法等の一部を改正する法律案,成立,経過,https://www.shugiin.go.jp/internet/itdb_gian.nsf/html/gian/keika/1DC8102.htm,本文,https://www.shugiin.go.jp/internet/itdb_gian.nsf/html/gian/honbun/g19609030.htm,閣法,196,30,不正競争防止法等の一部を改正する法律案,内閣,,／,平成30年 2月27日,平成30年 4月17日／経済産業,平成30年 5月11日／可決,平成30年 5月15日／可決,多数,自由民主党; 立憲民主党・市民クラブ; 国民民主党・無所属クラブ; 公明党; 無所属の会; 日本維新の会; 自由党; 社会民主党・市民連合; 希望の党,日本共産党,平成30年 2月27日,／,平成30年 5月15日,平成30年 5月16日／経済産業,平成30年 5月22日／可決,平成30年 5月23日／可決,平成30年 5月30日／33
